{"conflicts":[],"edges":[{"id":"edge-documents-1","kind":"documents","origin":{"locator":"docs/decisions/ADR-0007.md#work-item","source_kind":"document"},"source_id":"work-item-1","status":"current","target_id":"decision-1"},{"id":"edge-included-1","kind":"included_in_pr","origin":{"locator":"pull/17/commits","source_kind":"github"},"source_id":"change-1","status":"current","target_id":"review-1"},{"id":"edge-introduced-1","kind":"introduced_by","origin":{"locator":"blame:src/auth.rs:42","source_kind":"git"},"source_id":"code-1","status":"current","target_id":"change-1"},{"id":"edge-resolves-1","kind":"resolves_issue","origin":{"locator":"pull/17#closing-issues","source_kind":"github"},"source_id":"review-1","status":"current","target_id":"work-item-1"},{"id":"edge-verifies-1","kind":"verified_by","origin":{"locator":"verification/auth.toml#ADR-0007","source_kind":"verification"},"source_id":"decision-1","status":"current","target_id":"verification-1"}],"goal":{"anchor_kinds":["decision","work_item"],"target_id":"code-1"},"nodes":[{"id":"change-1","kind":"change","origin":{"locator":"commit:1111111","revision":"1111111111111111111111111111111111111111","source_kind":"git"},"status":"current"},{"id":"code-1","kind":"code_target","origin":{"locator":"src/auth.rs:42","revision":"1111111111111111111111111111111111111111","source_kind":"git"},"status":"current"},{"id":"decision-1","kind":"decision","origin":{"locator":"docs/decisions/ADR-0007.md","source_kind":"document"},"outcome_id":"local-token-validation","status":"current","subject_id":"authentication-mode"},{"id":"review-1","kind":"review","origin":{"locator":"pull/17","observed_at":"2026-09-12T00:00:00Z","source_kind":"github"},"status":"current"},{"id":"verification-1","kind":"verification","origin":{"locator":"verification/auth.toml","source_kind":"verification"},"status":"current"},{"id":"work-item-1","kind":"work_item","origin":{"locator":"issues/12","observed_at":"2026-09-12T00:00:00Z","source_kind":"github"},"status":"current"}],"protocol_version":1,"request_id":"request-established-1","snapshot_id":"snapshot-demo-1"}
